{
  "fixture": "device-baseline-v5",
  "description": "List and object lifecycle: creatable/deletable objects and list-valued properties.",
  "device_instance": 1234,
  "device_name": "InteropDevice",
  "port": 47808,
  "objects": [
    {
      "type": "device",
      "instance": 1234,
      "object_name": "InteropDevice",
      "description": "Supports AddListElement/RemoveListElement on selected list properties; CreateObject/DeleteObject for test AV instances >= 100."
    },
    {
      "type": "analog-value",
      "instance": 1,
      "object_name": "AV-1",
      "present_value": 21.5
    },
    {
      "type": "binary-value",
      "instance": 1,
      "object_name": "BV-1",
      "present_value": "inactive"
    },
    {
      "type": "analog-value",
      "instance": 100,
      "object_name": "AV-DELETABLE-100",
      "present_value": 0,
      "description": "Deterministic deletable test object; CreateObject may allocate AV:101+."
    }
  ],
  "object_lifecycle": {
    "creatable_types": ["analog-value", "binary-value"],
    "precreated_deletable": [
      {"type": "analog-value", "instance": 100}
    ],
    "protected_objects": [
      {"type": "device", "instance": 1234},
      {"type": "analog-value", "instance": 1},
      {"type": "binary-value", "instance": 1}
    ],
    "allocated_instance_range": {
      "minimum": 200,
      "maximum": 299
    }
  },
  "notes": [
    "Creatable types: analog-value / binary-value with Object_Name initial property.",
    "Duplicate element / unknown object / inconsistent type / missing required initial property error paths.",
    "Object-ID allocation: BACnet4J getNextInstanceObjectNumber; tests prefer explicit AV:101+."
  ],
  "alignment": {
    "bacnet-stack": "live-native",
    "bacpypes3": "unsupported",
    "bacnet4j": "live-native",
    "worldiety": "unsupported"
  }
}
